{
  "schemaVersion": 1,
  "tool": { "name": "testguard", "version": "0.4.0" },
  "generatedAt": "2026-09-17T02:00:00Z",
  "ref": "origin/main",
  "base": "0f2a4c6e8b1d3f5a7c9e1b3d5f7a9c1e3b5d7f9a",
  "head": "9a7c5e3b1d0f8e6c4a2b0d8f6e4c2a0b8d6f4e2c",
  "includeDirty": false,
  "strict": false,
  "changed": 5,
  "evaluated": 3,
  "excluded": [
    { "file": "README.md", "by": "non-source" },
    { "file": "vitest.config.mjs", "by": "default:**/*.config.*" }
  ],
  "covered": [
    { "file": "src/redact.mjs", "by": "fault", "claimIds": ["REDACT-001", "REDACT-003"] },
    { "file": "src/legacy/format.mjs", "by": "ignore", "pattern": "src/legacy/**" }
  ],
  "uncovered": [
    {
      "file": "src/export.mjs",
      "kind": "source",
      "nearestClaimId": "REDACT-001",
      "suggestion": "testguard scaffold src/export.mjs --claim REDACT-001"
    }
  ],
  "reliedOn": [
    {
      "pattern": "src/legacy/**",
      "reason": "Scheduled for deletion in Q4; no new claims will be authored against it.",
      "expires": "2026-12-31T00:00:00Z",
      "files": ["src/legacy/format.mjs"]
    }
  ],
  "expired": [],
  "exitCode": 1
}
